{
  "$defs": {
    "entry": {
      "additionalProperties": false,
      "properties": {
        "assistant_contestant_allowed": {
          "const": false
        },
        "canon_write_allowed": {
          "const": false
        },
        "direct_tos_write_allowed": {
          "const": false
        },
        "forbidden_effects": {
          "items": {
            "minLength": 1,
            "type": "string"
          },
          "minItems": 1,
          "type": "array"
        },
        "helper_id": {
          "minLength": 1,
          "type": "string"
        },
        "live_protocol": {
          "const": false
        },
        "purpose": {
          "minLength": 1,
          "type": "string"
        },
        "required_evidence": {
          "items": {
            "minLength": 1,
            "type": "string"
          },
          "minItems": 1,
          "type": "array"
        },
        "requires_review": {
          "const": true
        },
        "review_status": {
          "const": "candidate_only"
        },
        "runtime_effect": {
          "enum": [
            "none",
            "candidate_only",
            "local_dry_run_candidate_only",
            "local_rehearsal_candidate_only"
          ]
        },
        "tos_canonization_allowed": {
          "const": false
        },
        "surface_role": {
          "const": "sophian_threshold_review_helpers"
        },
        "review_domain": {
          "const": "sophian_threshold"
        }
      },
      "required": [
        "assistant_contestant_allowed",
        "canon_write_allowed",
        "direct_tos_write_allowed",
        "forbidden_effects",
        "helper_id",
        "live_protocol",
        "purpose",
        "required_evidence",
        "requires_review",
        "review_status",
        "runtime_effect",
        "tos_canonization_allowed",
        "surface_role",
        "review_domain"
      ],
      "title": "agon-sophian-sdk-helper.schema.json item contract",
      "type": "object"
    }
  },
  "$schema": "https://json-schema.org/draft/2020-12/schema",
  "additionalProperties": false,
  "properties": {
    "count": {
      "const": 7
    },
    "digest": {
      "pattern": "^[0-9a-f]{64}$",
      "type": "string"
    },
    "registry_id": {
      "const": "agon.sophian_sdk_helpers.registry.v1"
    },
    "runtime_posture": {
      "const": "candidate_only"
    },
    "sophian_sdk_helper_candidates": {
      "items": {
        "$ref": "#/$defs/entry"
      },
      "maxItems": 7,
      "minItems": 7,
      "type": "array"
    },
    "surface_role": {
      "const": "sophian_threshold_review_helpers"
    },
    "review_domain": {
      "const": "sophian_threshold"
    }
  },
  "required": [
    "registry_id",
    "surface_role",
    "review_domain",
    "runtime_posture",
    "count",
    "sophian_sdk_helper_candidates",
    "digest"
  ],
  "title": "agon.sophian_sdk_helpers.registry.v1 generated registry contract",
  "type": "object"
}
