{
  "count": 7,
  "digest": "e25a0a6314999ebcf23aa1887b27ce3c8f980aa50ca6e1f99363cfce9cabd0f9",
  "registry_id": "agon.sophian_sdk_helpers.registry.v1",
  "runtime_posture": "candidate_only",
  "sophian_sdk_helper_candidates": [
    {
      "assistant_contestant_allowed": false,
      "canon_write_allowed": false,
      "direct_tos_write_allowed": false,
      "forbidden_effects": [
        "live_verdict_authority",
        "durable_scar_write",
        "retention_execution",
        "rank_mutation",
        "trust_mutation",
        "tree_of_sophia_canon_write",
        "direct_tos_write",
        "automatic_canonization",
        "kag_as_canon",
        "hidden_scheduler_action",
        "assistant_contestant_drift",
        "auto_doctrine_rewrite",
        "center_takeover_of_owner_truth",
        "eval_memo_stats_sovereignty",
        "stats_as_canon_authority",
        "eval_as_canon_authority",
        "memo_as_canon_authority",
        "sdk_hidden_write"
      ],
      "helper_id": "agon.sdk.sophian.load_threshold_registry_candidate",
      "live_protocol": false,
      "purpose": "Load Sophian threshold registries.",
      "required_evidence": [
        "registry_path"
      ],
      "requires_review": true,
      "review_status": "candidate_only",
      "runtime_effect": "candidate_only",
      "tos_canonization_allowed": false,
      "surface_role": "sophian_threshold_review_helpers",
      "review_domain": "sophian_threshold"
    },
    {
      "assistant_contestant_allowed": false,
      "canon_write_allowed": false,
      "direct_tos_write_allowed": false,
      "forbidden_effects": [
        "live_verdict_authority",
        "durable_scar_write",
        "retention_execution",
        "rank_mutation",
        "trust_mutation",
        "tree_of_sophia_canon_write",
        "direct_tos_write",
        "automatic_canonization",
        "kag_as_canon",
        "hidden_scheduler_action",
        "assistant_contestant_drift",
        "auto_doctrine_rewrite",
        "center_takeover_of_owner_truth",
        "eval_memo_stats_sovereignty",
        "stats_as_canon_authority",
        "eval_as_canon_authority",
        "memo_as_canon_authority",
        "sdk_hidden_write"
      ],
      "helper_id": "agon.sdk.sophian.draft_threshold_packet_candidate",
      "live_protocol": false,
      "purpose": "Draft ToS threshold packet candidates.",
      "required_evidence": [
        "kag_candidate",
        "memo_package",
        "eval_alignment"
      ],
      "requires_review": true,
      "review_status": "candidate_only",
      "runtime_effect": "candidate_only",
      "tos_canonization_allowed": false,
      "surface_role": "sophian_threshold_review_helpers",
      "review_domain": "sophian_threshold"
    },
    {
      "assistant_contestant_allowed": false,
      "canon_write_allowed": false,
      "direct_tos_write_allowed": false,
      "forbidden_effects": [
        "live_verdict_authority",
        "durable_scar_write",
        "retention_execution",
        "rank_mutation",
        "trust_mutation",
        "tree_of_sophia_canon_write",
        "direct_tos_write",
        "automatic_canonization",
        "kag_as_canon",
        "hidden_scheduler_action",
        "assistant_contestant_drift",
        "auto_doctrine_rewrite",
        "center_takeover_of_owner_truth",
        "eval_memo_stats_sovereignty",
        "stats_as_canon_authority",
        "eval_as_canon_authority",
        "memo_as_canon_authority",
        "sdk_hidden_write"
      ],
      "helper_id": "agon.sdk.sophian.validate_threshold_packet_candidate",
      "live_protocol": false,
      "purpose": "Validate threshold packet shape and stop-lines.",
      "required_evidence": [
        "threshold_packet"
      ],
      "requires_review": true,
      "review_status": "candidate_only",
      "runtime_effect": "candidate_only",
      "tos_canonization_allowed": false,
      "surface_role": "sophian_threshold_review_helpers",
      "review_domain": "sophian_threshold"
    },
    {
      "assistant_contestant_allowed": false,
      "canon_write_allowed": false,
      "direct_tos_write_allowed": false,
      "forbidden_effects": [
        "live_verdict_authority",
        "durable_scar_write",
        "retention_execution",
        "rank_mutation",
        "trust_mutation",
        "tree_of_sophia_canon_write",
        "direct_tos_write",
        "automatic_canonization",
        "kag_as_canon",
        "hidden_scheduler_action",
        "assistant_contestant_drift",
        "auto_doctrine_rewrite",
        "center_takeover_of_owner_truth",
        "eval_memo_stats_sovereignty",
        "stats_as_canon_authority",
        "eval_as_canon_authority",
        "memo_as_canon_authority",
        "sdk_hidden_write"
      ],
      "helper_id": "agon.sdk.sophian.export_tos_review_bundle_candidate",
      "live_protocol": false,
      "purpose": "Export reviewable ToS bundle without writing canon.",
      "required_evidence": [
        "review_bundle"
      ],
      "requires_review": true,
      "review_status": "candidate_only",
      "runtime_effect": "candidate_only",
      "tos_canonization_allowed": false,
      "surface_role": "sophian_threshold_review_helpers",
      "review_domain": "sophian_threshold"
    },
    {
      "assistant_contestant_allowed": false,
      "canon_write_allowed": false,
      "direct_tos_write_allowed": false,
      "forbidden_effects": [
        "live_verdict_authority",
        "durable_scar_write",
        "retention_execution",
        "rank_mutation",
        "trust_mutation",
        "tree_of_sophia_canon_write",
        "direct_tos_write",
        "automatic_canonization",
        "kag_as_canon",
        "hidden_scheduler_action",
        "assistant_contestant_drift",
        "auto_doctrine_rewrite",
        "center_takeover_of_owner_truth",
        "eval_memo_stats_sovereignty",
        "stats_as_canon_authority",
        "eval_as_canon_authority",
        "memo_as_canon_authority",
        "sdk_hidden_write"
      ],
      "helper_id": "agon.sdk.sophian.inspect_canon_restraint_candidate",
      "live_protocol": false,
      "purpose": "Inspect canon restraint stop-lines.",
      "required_evidence": [
        "stop_line_registry"
      ],
      "requires_review": true,
      "review_status": "candidate_only",
      "runtime_effect": "candidate_only",
      "tos_canonization_allowed": false,
      "surface_role": "sophian_threshold_review_helpers",
      "review_domain": "sophian_threshold"
    },
    {
      "assistant_contestant_allowed": false,
      "canon_write_allowed": false,
      "direct_tos_write_allowed": false,
      "forbidden_effects": [
        "live_verdict_authority",
        "durable_scar_write",
        "retention_execution",
        "rank_mutation",
        "trust_mutation",
        "tree_of_sophia_canon_write",
        "direct_tos_write",
        "automatic_canonization",
        "kag_as_canon",
        "hidden_scheduler_action",
        "assistant_contestant_drift",
        "auto_doctrine_rewrite",
        "center_takeover_of_owner_truth",
        "eval_memo_stats_sovereignty",
        "stats_as_canon_authority",
        "eval_as_canon_authority",
        "memo_as_canon_authority",
        "sdk_hidden_write"
      ],
      "helper_id": "agon.sdk.sophian.draft_rejection_or_defer_notice_candidate",
      "live_protocol": false,
      "purpose": "Draft review notices without deciding them.",
      "required_evidence": [
        "notice_scope",
        "reason"
      ],
      "requires_review": true,
      "review_status": "candidate_only",
      "runtime_effect": "candidate_only",
      "tos_canonization_allowed": false,
      "surface_role": "sophian_threshold_review_helpers",
      "review_domain": "sophian_threshold"
    },
    {
      "assistant_contestant_allowed": false,
      "canon_write_allowed": false,
      "direct_tos_write_allowed": false,
      "forbidden_effects": [
        "live_verdict_authority",
        "durable_scar_write",
        "retention_execution",
        "rank_mutation",
        "trust_mutation",
        "tree_of_sophia_canon_write",
        "direct_tos_write",
        "automatic_canonization",
        "kag_as_canon",
        "hidden_scheduler_action",
        "assistant_contestant_drift",
        "auto_doctrine_rewrite",
        "center_takeover_of_owner_truth",
        "eval_memo_stats_sovereignty",
        "stats_as_canon_authority",
        "eval_as_canon_authority",
        "memo_as_canon_authority",
        "sdk_hidden_write"
      ],
      "helper_id": "agon.sdk.sophian.summarize_threshold_owner_review_candidate",
      "live_protocol": false,
      "purpose": "Summarize owner review state.",
      "required_evidence": [
        "owner_review_records"
      ],
      "requires_review": true,
      "review_status": "candidate_only",
      "runtime_effect": "candidate_only",
      "tos_canonization_allowed": false,
      "surface_role": "sophian_threshold_review_helpers",
      "review_domain": "sophian_threshold"
    }
  ],
  "surface_role": "sophian_threshold_review_helpers",
  "review_domain": "sophian_threshold"
}
